{
  "arch": "sm_86",
  "artifact_id": "cutlass_successor_sm86_v1",
  "artifacts": {
    "binary": {
      "bytes": 356424,
      "path": "workloads/simbench_bw/l1/vendor_gemm_cutlass/vendor_gemm_cutlass_run",
      "sha256": "267fed46c8b307a1c88afa7f463abea08c199bd1338e03aca0c5bcee4e08fb4b"
    },
    "control_bits": {
      "bytes": 874747,
      "command": [
        "/home/jakeshea/GPU_simulator_rebase_0723/.venv/bin/python",
        "tools/sass_control/emit_control_bits_sidecar.py",
        "--binary",
        "workloads/simbench_bw/l1/vendor_gemm_cutlass/vendor_gemm_cutlass_run",
        "--arch",
        "sm_86",
        "--out",
        "data/annex/cutlass_successor_sm86_20260723/vendor_gemm_cutlass.control_bits.json",
        "--toolkit-bindir",
        "/usr/local/cuda-13.2/bin"
      ],
      "command_stderr_sha256": "e3b0c44298fc1c149afbf4c8996fb92427ae41e4649b934ca495991b7852b855",
      "command_stdout_sha256": "7254f95e127c5c3c59c9391f393fb9b54bf699ea06a7e5384428ccaf054611ef",
      "decoded_instructions": 2472,
      "function_count": 1,
      "path": "data/annex/cutlass_successor_sm86_20260723/vendor_gemm_cutlass.control_bits.json",
      "sha256": "cfabb51412c64aec1a82d5c52fb87b0c39ee418cb008cee829940c4bfc002cfd",
      "toolkit_version": "V13.2",
      "unknown_encoding": 0
    },
    "cubin_inventory": {
      "command": [
        "/usr/local/cuda-13.2/bin/cuobjdump",
        "--list-elf",
        "workloads/simbench_bw/l1/vendor_gemm_cutlass/vendor_gemm_cutlass_run"
      ],
      "cubins": [
        "vendor_gemm_cutlass-main.sm_86.cubin",
        "vendor_gemm_cutlass.sm_86.cubin",
        "main.sm_86.cubin"
      ],
      "sm86_cubin_present": true,
      "transcript_bytes": 131,
      "transcript_sha256": "eb266e8e204e34f478894c7bc2b56d2a59ddb420a9c825e9307fcebf62cc3524"
    },
    "no_cublas": {
      "elf": {
        "binary_bytes": 356424,
        "binary_sha256": "267fed46c8b307a1c88afa7f463abea08c199bd1338e03aca0c5bcee4e08fb4b",
        "forbidden_dependency_count": 0,
        "forbidden_dynamic_symbol_count": 0,
        "needed_libraries": [
          "libc.so.6",
          "libcudart.so.13",
          "libgcc_s.so.1",
          "libm.so.6",
          "libstdc++.so.6"
        ],
        "readelf_dynamic_bytes": 1681,
        "readelf_dynamic_sha256": "e215f58d3e870b181a28189211e22867d32daeeedff9f79558ecb48ff92adafd",
        "readelf_dynamic_symbols_bytes": 4229,
        "readelf_dynamic_symbols_sha256": "7bdb0125d012246c5e187ed60d2df214ba8e30a6fe739a502a3c47685c1ac285"
      },
      "pass": true,
      "source": {
        "files": {
          "workloads/simbench_bw/common.mk": "e5dea6d25c243455de5a84dbd715abfeb94c342b37e7f194eb117e80c1a48f9e",
          "workloads/simbench_bw/l1/vendor_gemm_cutlass/Makefile": "a4e8b371bb9f6b42c8cb57d1540d7e8a79d69251ab71c8cc342d082d10fc4d36",
          "workloads/simbench_bw/l1/vendor_gemm_cutlass/main.cu": "12999fe4a48f7fab567fc804ab1a9e4b9621c14deef50e293f11f168920218e8",
          "workloads/simbench_bw/l1/vendor_gemm_cutlass/vendor_gemm_cutlass.cu": "3403a4f5fe6a086fca1478e1aa827059f864922209bc4b14fe88d1bf6de74af6",
          "workloads/simbench_bw/shapes/vendor_gemm_cutlass.toml": "4b05b54ca7a869ad00ebdf56bf06f5dcd4069c6d30f6e32797e46c2b6588c169"
        },
        "forbidden_library_policy": "reject_cublas_cublaslt_cublasxt_source_and_link_references",
        "input_set_sha256": "68bf0566d19f35c49de0e6d6ac232650ff14584a760019e289588bea0ffbbe29"
      }
    },
    "sass": {
      "bytes": 565661,
      "command": [
        "/usr/local/cuda-13.2/bin/cuobjdump",
        "--dump-sass",
        "workloads/simbench_bw/l1/vendor_gemm_cutlass/vendor_gemm_cutlass_run"
      ],
      "path": "data/annex/cutlass_successor_sm86_20260723/vendor_gemm_cutlass.sass",
      "sha256": "05577a1e31fb37af72d433af12fb3a247b8109aaddf193c9325021d1c72887ef"
    }
  },
  "base_frozen_v1": {
    "authority_path": "data/local_labels/campaign/capture_roster_authority_sm86.json",
    "authority_sha256": "d02c817091b0a9f06c2106c0987c59a481910afcc3b78ab1de7a7d5bd5a6b4b4",
    "base_authority_cell_sha256": "1e84352627f783b1d28fb3684cab96a61fa10cbdbb9c0e0b8844b027c1dc6142",
    "base_disposition": "runnable",
    "base_slug": "vendor_gemm_cublas",
    "claim_policy": "none_additive_supplement_only",
    "matrix_file_sha256": "af29d72e955cf42e281036190f2d55d72af0af92a632c78c8d159073a072fb0e",
    "matrix_path": "data/local_labels/campaign/sm86_reference_capture_matrix.json",
    "matrix_seal_sha256": "6376da9721c75bb9299e84a9d11bf607bc21f4cbaa30da25b672c86f6757a5e1",
    "matrix_source_commit": "124ce358733f97ba6e0af808d10ab69ffe4d5a78",
    "relation": "evaluation_successor_no_relabel"
  },
  "build": {
    "command": [
      "make",
      "-B",
      "-C",
      "workloads/simbench_bw/l1/vendor_gemm_cutlass",
      "run-bin",
      "NVCC=/usr/local/cuda-13.2/bin/nvcc",
      "NVCC_CCBIN=/usr/bin/g++-14",
      "CUOBJDUMP=/usr/local/cuda-13.2/bin/cuobjdump",
      "CUTLASS_DIR=/home/jakeshea/GPU_simulator_rebase_0723/third_party/cutlass"
    ],
    "executed": true,
    "returncode": 0,
    "transcript_bytes": 8743,
    "transcript_path": "data/annex/cutlass_successor_sm86_20260723/vendor_gemm_cutlass.build.log",
    "transcript_sha256": "72832fc0398c0f7608283629c3d8a89a7aafe1440ee2eb9785ffb3cfe9c745c3"
  },
  "control_contract": {
    "all_records_decoded": true,
    "code_arch": "sm_86",
    "execution_arch": "sm_86",
    "function_count": 1,
    "hardware_capture_status": "not_run_build_witness_only",
    "policy": "direct_executable"
  },
  "cutlass_provenance": {
    "path": "third_party/cutlass.provenance.json",
    "scoped_digest": "ad131382834231e4076b50c8fdf8f7783504fe83aac53982dab353be9908e113",
    "sha256": "a0a1f173cd899237ae2485eda4318029e6c67674eab2bd1685eee1fa92a2e6f8",
    "upstream_commit": "e05f953a5b3d38adc240df2ff928e0421c2abba3",
    "upstream_tag": "v4.6.1",
    "upstream_tree": "0d3dd31da2e1ccc8ab15047a2edd9ebf5d98218b",
    "version": {
      "major": 4,
      "minor": 6,
      "patch": 1
    }
  },
  "generated_at_utc": "2026-07-23T13:53:27Z",
  "integrity": {
    "all_checks_pass": true,
    "frozen_base_unchanged": true,
    "row_count": 1,
    "source_commit_inputs_match": true,
    "unique_slugs": true
  },
  "live_cutlass_inputs": {
    "build_subdirectories": [
      "include",
      "tools/util/include"
    ],
    "root": "third_party/cutlass",
    "tree_hash": "5c8afcd3e4e8ebc379cbeb73a58354a948eb4e222a57058f7fd5bffcf8b4f3a8"
  },
  "pass": true,
  "schema_version": 1,
  "shape_authority": {
    "actual_args": [
      "--m",
      "32",
      "--n",
      "32",
      "--k",
      "32",
      "--seed",
      "42",
      "--shape-point",
      "trace_00"
    ],
    "path": "workloads/simbench_bw/shapes/vendor_gemm_cutlass.toml",
    "sha256": "4b05b54ca7a869ad00ebdf56bf06f5dcd4069c6d30f6e32797e46c2b6588c169",
    "shape_contract": "trace_shape_is_actual_direct_executable_launch",
    "shape_role": "trace",
    "slug": "vendor_gemm_cutlass",
    "trace_shape": {
      "axes": {
        "k": 32,
        "m": 32,
        "n": 32
      },
      "estimator_source": "static",
      "launch_config": {
        "block": [
          64,
          1,
          1
        ],
        "grid": [
          2,
          2,
          1
        ]
      },
      "name": "trace_00",
      "predicted_bytes": 5242880
    },
    "trace_shape_sha256": "ddd4342c2170c8f959f42d8e1ccf4d385e27d6b8e90c0c0c3bb4fa5774463dc5"
  },
  "sku": "rtx_3090_ti",
  "smoke": {
    "command": [
      "./vendor_gemm_cutlass_run",
      "--m",
      "32",
      "--n",
      "32",
      "--k",
      "32",
      "--seed",
      "42",
      "--shape-point",
      "trace_00"
    ],
    "contract_ok": true,
    "output_bytes": 13100,
    "output_sha256": "8c4686319bd077daf855d63866ff3ed529703725392d004c3dc16fb830c75e8d",
    "reported_shape_axes": {
      "k": 32,
      "m": 32,
      "n": 32
    },
    "reported_shape_point": "trace_00",
    "reported_shape_role": "trace",
    "reported_shape_set": "successor_shapes",
    "reported_slug": "vendor_gemm_cutlass",
    "returncode": 0
  },
  "source_commit": "a31511f3a53c63f282dede8d59fdce0587952059",
  "source_inputs": {
    "files": {
      "tools/local_labels/build_cutlass_successor_witness.py": "c82b8da4df42a9696f89390875152b68a9feba553966cbb73adf91a5dae719d6",
      "tools/local_labels/verify_cutlass_successor_artifact.py": "8a692fb2cdfba684802b3e944ebadb71aa82a8a8db2de544e226ae883565885d",
      "workloads/simbench_bw/common.mk": "e5dea6d25c243455de5a84dbd715abfeb94c342b37e7f194eb117e80c1a48f9e",
      "workloads/simbench_bw/l1/vendor_gemm_cutlass/Makefile": "a4e8b371bb9f6b42c8cb57d1540d7e8a79d69251ab71c8cc342d082d10fc4d36",
      "workloads/simbench_bw/l1/vendor_gemm_cutlass/main.cu": "12999fe4a48f7fab567fc804ab1a9e4b9621c14deef50e293f11f168920218e8",
      "workloads/simbench_bw/l1/vendor_gemm_cutlass/vendor_gemm_cutlass.cu": "3403a4f5fe6a086fca1478e1aa827059f864922209bc4b14fe88d1bf6de74af6",
      "workloads/simbench_bw/schemas/cutlass_successor_build_witness.schema.json": "5d75745494d7f31499836593561196d3ad550f44e2fd94cfc1f3bc508f248e85",
      "workloads/simbench_bw/shapes/vendor_gemm_cutlass.toml": "4b05b54ca7a869ad00ebdf56bf06f5dcd4069c6d30f6e32797e46c2b6588c169"
    },
    "input_set_sha256": "808af27d11c8d7b20222d46761b755f029d0a88d022a686ab5e718544a2b5ccc",
    "policy": "source_and_makefile_no_cublas_references"
  },
  "toolchain": {
    "cuobjdump": {
      "path": "/usr/local/cuda-13.2/bin/cuobjdump",
      "sha256": "903c5e1324669c1222b13ede0fc7226f48f7db355669f2912f0236031c56e1bf",
      "version_returncode": 0,
      "version_stderr": "",
      "version_stdout": "cuobjdump: NVIDIA (R) fat binary listing tool\nCopyright (c) 2005-2026 NVIDIA Corporation\nBuilt on Mon_Mar_02_09:52:23_PM_PST_2026\nCuda compilation tools, release 13.2, V13.2.51\nBuild cuda_13.2.r13.2/compiler.37434383_0\n"
    },